{
  "version": 2,
  "provider": "github",
  "repository": "Mineru98/skills-store",
  "updatedAt": "2026-08-26T00:00:00.000Z",
  "snapshot": {
    "status": "complete",
    "fetchedAt": "2026-08-26T00:00:00.000Z",
    "digest": "sha256:cccccccccccccccccccccccccccccccccccccccccccccccccccccccccccccccc",
    "reason": null
  },
  "nodes": {
    "101": {
      "id": "github:Mineru98/skills-store#101",
      "number": 101,
      "title": "parent A",
      "status": "open",
      "labels": [],
      "url": "https://github.com/Mineru98/skills-store/issues/101",
      "context": {
        "problem": {"value": "fixture", "reason": "fixture", "source": "fixture"},
        "outcome": {"value": "fixture", "reason": "fixture", "source": "fixture"},
        "scope": {"value": "fixture", "reason": "fixture", "source": "fixture"},
        "acceptance": {"value": "fixture", "reason": "fixture", "source": "fixture"},
        "result": {"value": "fixture", "reason": "fixture", "source": "fixture"},
        "components": {"value": "fixture", "reason": "fixture", "source": "fixture"},
        "decisions": {"value": "fixture", "reason": "fixture", "source": "fixture"},
        "evidence": {"value": "fixture", "reason": "fixture", "source": "fixture"}
      },
      "provenance": {
        "url": "https://github.com/Mineru98/skills-store/issues/101",
        "revision": "fixture",
        "observedAt": "2026-08-26T00:00:00.000Z"
      }
    },
    "102": {
      "id": "github:Mineru98/skills-store#102",
      "number": 102,
      "title": "parent B",
      "status": "open",
      "labels": [],
      "url": "https://github.com/Mineru98/skills-store/issues/102",
      "context": {
        "problem": {"value": "fixture", "reason": "fixture", "source": "fixture"},
        "outcome": {"value": "fixture", "reason": "fixture", "source": "fixture"},
        "scope": {"value": "fixture", "reason": "fixture", "source": "fixture"},
        "acceptance": {"value": "fixture", "reason": "fixture", "source": "fixture"},
        "result": {"value": "fixture", "reason": "fixture", "source": "fixture"},
        "components": {"value": "fixture", "reason": "fixture", "source": "fixture"},
        "decisions": {"value": "fixture", "reason": "fixture", "source": "fixture"},
        "evidence": {"value": "fixture", "reason": "fixture", "source": "fixture"}
      },
      "provenance": {
        "url": "https://github.com/Mineru98/skills-store/issues/102",
        "revision": "fixture",
        "observedAt": "2026-08-26T00:00:00.000Z"
      }
    }
  },
  "edges": [
    {
      "from": 101,
      "to": 102,
      "type": "parent-of",
      "provenance": {
        "url": "https://github.com/Mineru98/skills-store/issues/101",
        "digest": "sha256:dddddddddddddddddddddddddddddddddddddddddddddddddddddddddddddddd"
      }
    },
    {
      "from": 102,
      "to": 101,
      "type": "parent-of",
      "provenance": {
        "url": "https://github.com/Mineru98/skills-store/issues/102",
        "digest": "sha256:eeeeeeeeeeeeeeeeeeeeeeeeeeeeeeeeeeeeeeeeeeeeeeeeeeeeeeeeeeeeeeee"
      }
    }
  ]
}
